{
  "meta": {
    "version": "v1",
    "generated_at_utc": "2026-01-10T10:00:00.000Z",
    "primary_country": "France",
    "secondary_countries": [],
    "target_role": "Data Analyst",
    "industry": "SaaS",
    "language": "fr",
    "ats_max_pages": 1,
    "recruiter_max_pages": 2
  },

  "input_summary": "Candidat avec une expérience analytique orientée données et reporting.",

  "selection_rationale": "Le CV met en avant des compétences pertinentes pour un poste de Data Analyst.",

  "cv": {
    "header": {
      "title": "Alex Martin",
      "subtitle": null
    },
    "experience": [],
    "education": [],
    "skills": []
  },

  "alternates": []
}
